smartctl 7.1 2019-12-30 r5022 [x86_64-linux-4.19.107-Unraid] (local build)
Copyright (C) 2002-19, Bruce Allen, Christian Franke, www.smartmontools.org

=== START OF READ SMART DATA SECTION ===
SMART Attributes Data Structure revision number: 16
Vendor Specific SMART Attributes with Thresholds:
ID# ATTRIBUTE_NAME          FLAG     VALUE WORST THRESH TYPE      UPDATED  WHEN_FAILED RAW_VALUE
  1 Raw_Read_Error_Rate     0x000b   100   100   050    Pre-fail  Always       -       0
  9 Power_On_Hours          0x0012   100   100   000    Old_age   Always       -       6947
 12 Power_Cycle_Count       0x0012   100   100   000    Old_age   Always       -       21
168 Unknown_Attribute       0x0012   100   100   000    Old_age   Always       -       0
170 Unknown_Attribute       0x0003   095   095   000    Pre-fail  Always       -       21474836542
173 Unknown_Attribute       0x0012   100   100   000    Old_age   Always       -       2883650
192 Power-Off_Retract_Count 0x0012   100   100   000    Old_age   Always       -       20
194 Temperature_Celsius     0x0023   067   067   000    Pre-fail  Always       -       33 (Min/Max 33/33)
218 Unknown_Attribute       0x000b   100   100   050    Pre-fail  Always       -       0
231 Temperature_Celsius     0x0013   100   100   000    Pre-fail  Always       -       98
241 Total_LBAs_Written      0x0012   100   100   000    Old_age   Always       -       4068

